{
  "$schema": "https://json-schema.org/draft/2020-12/schema",
  "$id": "https://webflix-lab.dev/contracts/source-artifact.schema.json",
  "type": "object",
  "properties": {
    "recordType": {
      "type": "string",
      "const": "SourceArtifact"
    },
    "contractVersion": {
      "type": "string",
      "pattern": "^1\\.\\d+\\.\\d+$",
      "description": "Contract bundle version (major must match 1.x.x of the frozen contracts)."
    },
    "id": {
      "type": "string",
      "minLength": 1,
      "maxLength": 200,
      "pattern": "^[A-Za-z0-9][A-Za-z0-9._:-]*$",
      "description": "Stable identifier, e.g. \"claim-tool-catalog-1\"."
    },
    "title": {
      "type": "string",
      "minLength": 1,
      "maxLength": 300,
      "description": "Human-readable source title."
    },
    "provenance": {
      "description": "Provenance and authorization state of a source.",
      "$ref": "#/$defs/SourceProvenance"
    },
    "fingerprint": {
      "description": "Content-identity fingerprint of a source.",
      "$ref": "#/$defs/Fingerprint"
    },
    "text": {
      "type": "string",
      "minLength": 1,
      "description": "NFC-normalized canonical text. Every offset in the IR indexes into this string."
    },
    "blocks": {
      "readOnly": true,
      "description": "Structural blocks; ordered, non-overlapping (deep-validated).",
      "minItems": 1,
      "type": "array",
      "items": {
        "type": "object",
        "properties": {
          "id": {
            "type": "string",
            "minLength": 1,
            "maxLength": 200,
            "pattern": "^[A-Za-z0-9][A-Za-z0-9._:-]*$",
            "description": "Stable identifier, e.g. \"claim-tool-catalog-1\"."
          },
          "kind": {
            "type": "string",
            "enum": [
              "heading",
              "paragraph",
              "list-item",
              "quote",
              "code"
            ],
            "description": "Structural kind of a source block."
          },
          "text": {
            "type": "string",
            "minLength": 1,
            "description": "Exact substring of the source text between start and end (markers included)."
          },
          "start": {
            "type": "integer",
            "minimum": 0,
            "maximum": 9007199254740991,
            "description": "Inclusive start offset in UTF-16 code units into the source text."
          },
          "end": {
            "type": "integer",
            "minimum": 0,
            "maximum": 9007199254740991,
            "description": "Exclusive end offset in UTF-16 code units."
          },
          "level": {
            "description": "Heading level; required when kind is \"heading\", forbidden otherwise.",
            "type": "integer",
            "minimum": 1,
            "maximum": 6
          }
        },
        "required": [
          "id",
          "kind",
          "text",
          "start",
          "end"
        ],
        "additionalProperties": false,
        "title": "SourceBlock",
        "description": "One structural block of a source with exact offsets.",
        "$ref": "#/$defs/SourceBlock"
      }
    },
    "language": {
      "type": "string",
      "pattern": "^[A-Za-z]{2,8}(-[A-Za-z0-9]{1,8})*$",
      "description": "BCP-47 language tag, e.g. \"en\" or \"pt-BR\"."
    },
    "wordCount": {
      "type": "integer",
      "minimum": 1,
      "maximum": 9007199254740991,
      "description": "Whitespace-delimited word count of text."
    },
    "createdAt": {
      "type": "string",
      "pattern": "^\\d{4}-\\d{2}-\\d{2}T\\d{2}:\\d{2}:\\d{2}(\\.\\d+)?Z$",
      "description": "ISO-8601 UTC timestamp, e.g. \"2026-09-26T19:26:00Z\"."
    },
    "normalizer": {
      "type": "string",
      "minLength": 1,
      "maxLength": 200,
      "description": "Adapter identity that produced this artifact, e.g. \"MarkdownNoteAdapter@0.1.0\"."
    }
  },
  "required": [
    "recordType",
    "contractVersion",
    "id",
    "title",
    "provenance",
    "fingerprint",
    "text",
    "blocks",
    "language",
    "wordCount",
    "createdAt",
    "normalizer"
  ],
  "additionalProperties": false,
  "title": "SourceArtifact",
  "$defs": {
    "SourceProvenance": {
      "type": "object",
      "properties": {
        "kind": {
          "type": "string",
          "enum": [
            "markdown-note",
            "plain-text",
            "pasted-text",
            "public-article",
            "substack",
            "rss",
            "pdf-text",
            "epub"
          ],
          "description": "Kind of ingest path that produced the source."
        },
        "label": {
          "type": "string",
          "minLength": 1,
          "maxLength": 300,
          "description": "Human-readable origin, e.g. a file name or site name."
        },
        "url": {
          "description": "Canonical public URL when fetched from the public web. Omitted for local or pasted inputs.",
          "type": "string",
          "format": "uri"
        },
        "fetchedAt": {
          "description": "When the content was fetched (UTC).",
          "type": "string",
          "pattern": "^\\d{4}-\\d{2}-\\d{2}T\\d{2}:\\d{2}:\\d{2}(\\.\\d+)?Z$"
        },
        "authorization": {
          "type": "string",
          "enum": [
            "public",
            "operator-authorized",
            "user-provided"
          ],
          "description": "Authorization state for the ingest path used."
        }
      },
      "required": [
        "kind",
        "label",
        "authorization"
      ],
      "additionalProperties": false,
      "title": "SourceProvenance"
    },
    "Fingerprint": {
      "type": "object",
      "properties": {
        "contentSha256": {
          "type": "string",
          "pattern": "^[0-9a-f]{64}$",
          "description": "SHA-256 of the UTF-8 bytes of the normalized text."
        },
        "rawSha256": {
          "type": "string",
          "pattern": "^[0-9a-f]{64}$",
          "description": "SHA-256 of the raw input bytes as ingested, before normalization."
        },
        "textLength": {
          "type": "integer",
          "minimum": 0,
          "maximum": 9007199254740991,
          "description": "Length of the normalized text in UTF-16 code units."
        }
      },
      "required": [
        "contentSha256",
        "rawSha256",
        "textLength"
      ],
      "additionalProperties": false,
      "title": "Fingerprint"
    },
    "SourceBlock": {
      "type": "object",
      "properties": {
        "id": {
          "type": "string",
          "minLength": 1,
          "maxLength": 200,
          "pattern": "^[A-Za-z0-9][A-Za-z0-9._:-]*$",
          "description": "Stable identifier, e.g. \"claim-tool-catalog-1\"."
        },
        "kind": {
          "type": "string",
          "enum": [
            "heading",
            "paragraph",
            "list-item",
            "quote",
            "code"
          ],
          "description": "Structural kind of a source block."
        },
        "text": {
          "type": "string",
          "minLength": 1,
          "description": "Exact substring of the source text between start and end (markers included)."
        },
        "start": {
          "type": "integer",
          "minimum": 0,
          "maximum": 9007199254740991,
          "description": "Inclusive start offset in UTF-16 code units into the source text."
        },
        "end": {
          "type": "integer",
          "minimum": 0,
          "maximum": 9007199254740991,
          "description": "Exclusive end offset in UTF-16 code units."
        },
        "level": {
          "description": "Heading level; required when kind is \"heading\", forbidden otherwise.",
          "type": "integer",
          "minimum": 1,
          "maximum": 6
        }
      },
      "required": [
        "id",
        "kind",
        "text",
        "start",
        "end"
      ],
      "additionalProperties": false,
      "title": "SourceBlock"
    }
  }
}
