{
  "recordType": "SourceArtifact",
  "contractVersion": "1.0.0",
  "id": "source-two-blocks",
  "title": "Two-block note",
  "provenance": {
    "kind": "plain-text",
    "label": "two-blocks.txt",
    "authorization": "user-provided"
  },
  "fingerprint": {
    "contentSha256": "e94541d24408957cae3817ff5fc46a3c37ce411148fd489790bd81919bfedcaf",
    "rawSha256": "e94541d24408957cae3817ff5fc46a3c37ce411148fd489790bd81919bfedcaf",
    "textLength": 58
  },
  "text": "Alpha tools need scheduled audits.\nBeta tools ship weekly.",
  "blocks": [
    {
      "id": "b1",
      "kind": "paragraph",
      "text": "Alpha tools need scheduled audits.",
      "start": 0,
      "end": 34
    },
    {
      "id": "b2",
      "kind": "paragraph",
      "text": "Beta tools ship weekly.",
      "start": 25,
      "end": 58
    }
  ],
  "language": "en",
  "wordCount": 9,
  "createdAt": "2026-09-26T00:00:00Z",
  "normalizer": "fixture-builder@1.0.0"
}
